empresa,nome_vaga,localidade,descricao,requisitos,link,data_etl
AMCOM,Pessoa Cientista de Dados Sênior com foco em IA Generativa,Remota,"Somos inspired by tech powered by people. Por isso, precisamos de pessoas apaixonados por desafios e com sede de aprendizado contínuo. Buscamos por novos makers para sonharem com a gente, que enxerguem além do óbvio e que estejam prontos para se juntar a nós nessa jornada de transformação e crescimento. Estamos expandindo nossos horizontes e buscamos pessoas que compartilhem dessa mesma paixão pela tecnologia e pelo aprendizado contínuo. Se você se encaixa nesse perfil, venha fazer parte do noss...","Experiência sólida com Python; | Conhecimento avançado em Machine Learning e NLP; | Experiência prática com LLMs e IA Generativa; | Implementação de arquitetura RAG; | Experiência com bancos vetoriais (FAISS, Pinecone, Weaviate, Chroma ou similares);",https://amcom.inhire.app/vagas/2637bc80-302d-4e04-91f3-0e1dae96a0bb/pessoa-cientista-de-dados-senior-com-foco-em-ia-generativa,2026-03-12 11:39:18
AMCOM,Pessoa Cientista de Dados com IA Especialista,Remota,"Somos inspired by tech powered by people. Por isso, precisamos de pessoas apaixonados por desafios e com sede de aprendizado contínuo. Buscamos por novos makers para sonharem com a gente, que enxerguem além do óbvio e que estejam prontos para se juntar a nós nessa jornada de transformação e crescimento. Estamos expandindo nossos horizontes e buscamos pessoas que compartilhem dessa mesma paixão pela tecnologia e pelo aprendizado contínuo. Se você se encaixa nesse perfil, venha fazer parte do noss...","Experiência comprovada com IA Generativa e Modelos de Linguagem (LLMs); | Experiência no desenvolvimento de chatbots e sistemas conversacionais; | Conhecimento prático em LangChain e LangGraph; | Experiência com Machine Learning, do treinamento ao uso em produção; | Conhecimento em APIs e frameworks para desenvolvimento de serviços, incluindo exposição e integração de sistemas;",https://amcom.inhire.app/vagas/17893ebe-4149-4316-b437-11b78c08304b/pessoa-cientista-de-dados-com-ia-especialista,2026-03-12 11:39:25
AUVOTECNOLOGIA,Analista de Dados - Inteligência Comercial (Remoto),Remoto,"Na Auvo, dados não existem para virar relatório bonito, eles existem paraprovocar decisão, corrigir rota e acelerar crescimento. Estamos buscando uma pessoade Dados – Inteligência Comercialpara estruturar, analisar e transformar dados demarketing, pré-vendas e vendaseminteligência acionável, com forte atuação noHubSpotcomo fonte central de informação. Analisar performance de campanhas, canais e cohorts de aquisição","SQL sólido | Forte raciocínio analítico | Leitura e interpretação de métricas de marketing e vendas (funil, conversão, CAC, LTV, pipeline, churn, retenção) | Experiência prática com CRM (preferencialmenteHubSpot) | Capacidade de estruturar análises de forma autônoma",https://auvotecnologia.inhire.app/vagas/713e134d-5602-4ddb-81e5-7fcbc2c55559/analista-de-dados-inteligencia-comercial-remoto,2026-03-12 11:39:45
CERC,Cientista de Dados Sênior,Remota,"Como Cientista de Dados na CERC, você vai:  Você pode dar match com nossos desafios tendo:","Formação em Estatística, Física ou cursos correlatos. | Conhecimento emmachine learning, estatística, modelagem preditiva e algoritmos avançados. | Proficiência emPython. | Experiência comengenharia de dados e arquitetura de dados, incluindo pipelines, banco de dados SQL/NoSQL e cloud computing (AWS, GCP ou Azure). | Capacidade de atuar em ambientesdesestruturados, definindo processos e frameworks do zero.",https://cerc.inhire.app/vagas/f72d3aa8-aa5d-401a-b0da-3184e44e20ab/cientista-de-dados-senior,2026-03-12 11:40:56
CERC,Engenheiro de Dados (KYP),Remota,"Como Engenheiro de Dados, você irá: Você pode dar match com nossos desafios tendo: Obrigatório:","Conhecimento avançado em Python, SQL, Spark; | Vivência integração contínua e entrega contínua (CI/CD); | Vivência orquestração de pipelines de dados; | Vivência com metodologia ágil; | Vivência em algum dos serviços de plataformas cloud (GCP, AWS ou Azure)",https://cerc.inhire.app/vagas/bedc42b0-a7fb-475f-a810-2f564675218d/engenheiro-de-dados-kyp,2026-03-12 11:41:03
CIELO,Analista de Dados Júnior | Vaga Exclusiva para PcD | Barueri (SP),Remoto,"Somos mais que uma máquina, somos pessoas que transformam ecriam infinitas possibilidades. Na Cielo, a gente trabalha comautonomiapara escrever nossa própria jornada,liberdadepara ser quem a gente é, e a oportunidade defazer acontecer. Somos um time quesonha no plural, oferecendo uma experiência completa e focando no bem-estar físico e mental de nossos mais de 7.000 colaboradores e suas famílias. Bora realizar seus sonhos com a gente!","Ensino Superior cursando e ou completo; | Domínio de ferramentas de análise Excel; | Conhecimento básico a intermediário em banco de dados (Ex.:SQL); | Aptidão em ferramentas de visualização de dados (Power Bi, Tableu, Looker e etc.); | Conhecimento básico em Python;",https://cielo.inhire.app/vagas/9761dc9b-0af4-4183-8236-da429c90163f/analista-de-dados-junior-or-vaga-exclusiva-para-pcd-or-barueri-sp,2026-03-12 11:41:22
CIELO,Coordenador (a) de Estratégia e Dados,Remoto,"Somos mais que uma máquina, somos pessoas que transformam ecriam infinitas possibilidades. Trabalhamos parasimplificar e impulsionar negócios para todas as pessoas,oferecendo soluções financeiras inteligentes. Aqui, investimos emtecnologia, promovemosdesenvolvimentoe fomentamos ainovaçãopara criar caminhos possíveis e gerar impacto positivo no mundo. Na Cielo, a gente trabalha comautonomiapara escrever nossa própria jornada,liberdadepara ser quem a gente é, e a oportunidade defazer acontecer. So...","Ensino Superior Completo em  ADM, Finanças, Economia e/ ou afins; | Pós graduação completa em ADM., Finanças, Ciencias Contabeis, Eng. e/ou afins; | Sólida experiência em Finanças, Planejamento e/ou Estratégia; | Ser orientado a resultado, buscando sempre a melhoria dos processos existentes; | Excel e PowePoint avançado;",https://cielo.inhire.app/vagas/1d846478-6242-41fd-b2d7-4f0c90e48552/coordenador-a-de-estrategia-e-dados,2026-03-12 11:42:02
GEX,Data View / Analista de Dados,Remota,"O time da GEX é formado por pessoas comGARRA— que aprendem fazendo, se envolvem de verdade com o que entregam e levam o trabalho a sério. Nos esforçamos todos os dias com o propósito de levareducação, saúde e qualidade de vidapara milhares de pessoas no Brasil e no mundo — com responsabilidade, agilidade e um toque humano em tudo o que fazemos. Aqui, valorizamos quempropõe, se envolve e quer crescer com a gente.Se você curte desafios, é comunicativo e busca um time colaborativo e de alta perform...",Experiência sólida comferramentas de BI e visualização de dados | Forte experiência comLooker (GCP) | Conhecimento emPower BIeTableau | Domínio deSQLpara exploração e validação de dados | Capacidade analítica estorytelling com dados,https://gex.inhire.app/vagas/974f67e0-7f6d-47c7-bcda-15756db4145f/data-view-analista-de-dados,2026-03-12 11:44:16
GEX,Engenheiro(a) de Dados,Remota,"O time da GEX é formado por pessoas comGARRA— que aprendem fazendo, se envolvem de verdade com o que entregam e levam o trabalho a sério. Nos esforçamos todos os dias com o propósito de levareducação, saúde e qualidade de vidapara milhares de pessoas no Brasil e no mundo — com responsabilidade, agilidade e um toque humano em tudo o que fazemos. Valorizamos quempropõe, constrói e quer crescer com a gente.Se você curte desafios técnicos, autonomia e um time colaborativo de alta performance,essa va...","Experiência sólida comengenharia de dados e construção de pipelines | Domínio deSQLemodelagem de dados | Experiência comPython aplicado a dados e automação | Vivência comserviços AWSvoltados a dados e integração | Experiência com ferramentas de orquestração(n8n, Airflow, Dagster ou Prefect)",https://gex.inhire.app/vagas/e4a00f1b-2daa-4ff7-b73c-622744ca23ce/engenheiroa-de-dados,2026-03-12 11:44:57
GRUPOESCALAR,Analista de Dados,presencial,"Missão do Cargo: Atuar como pilar de estruturação, controle e melhoria contínua da área de dados, promovendo uma cultura de agilidade, entregas com valor e visão estratégica. Será responsável por organizar os bancos de dados, facilitar as cerimônias ágeis e garantir a qualidade das entregas e da informação. Ser um protagonista na transformação digital. ",Superior em andamento ou completo; | Excel avançado,https://grupoescalar.inhire.app/vagas/101330a9-7ad3-4f8e-aed8-2d9a236eb62c/analista-de-dados,2026-03-12 11:45:16
KPMG,Analista de Dados,Não informado,"Inclusão e respeito à diversidade e equidade fazem parte do DNA da KPMG. Aqui valorizamos todas as pessoas, encorajando e empoderando os nossos profissionais para que se sintam parte das nossas conquistas. Independente da sua idade, gênero, raça, cor, credo, orientação, sexual, etnia, origem nacional ou deficiência, te convidamos a fazer a diferença. Venha fazer parte do time KPMG!","Formação em Ciência da Computação, análise e desenvolvimento de sistemas e áreas afins. | Capacidade de explicar conceitos técnicos de maneira clara e acessível para diferentes públicos. | Bons conhecimentos em Python. | Possuir experiência com SQL, Spark e databricks. | Desejável Power BI básico",https://kpmg.inhire.app/vagas/813d27b0-d4ea-4558-ac85-c23e781625a1/analista-de-dados,2026-03-12 11:47:38
LIVEMODE,Analista de Dados de Plataformas (IA),Presencial,"Claro, a paixão por esportes é indiscutível, mas também somos grandes amantes de inovação constante! Buscamos soluções digitais que conectem clubes, federações, ligas e marcas ao público de forma eficaz e inovadora. Nosso objetivo é construir um ecossistema que sustente o esporte nas próximas décadas, integrando o melhor do digital e da TV. É assim que estamos fazendo história e queremos encontrar mais pessoas que acreditem no potencial do que estamos construindo e queiram fazer parte disso. Dit...","Experiência prática e comprovada com IAaplicada à análise de dados; | Sólido conhecimento de métricas de redes sociais e da lógica de funcionamento e distribuiçãode conteúdonas principais plataformas (Instagram, TikTok, YouTube, WhatsApp, X); | Perfil analítico com forte orientação por dados,capaz de embasar recomendações em padrões e evidências concretas; | Autonomia para estruturar processos,priorizar entregas e gerar resultado; | Comunicação clara para traduzir análisesem direcionamentos objetivos para times não-técnicos.",https://livemode.inhire.app/vagas/a8ef055b-9501-44a1-b830-c5259ce76924/analista-de-dados-de-plataformas-ia,2026-03-12 11:48:30
MAGALU,Cientista de Dados Sr,remoto,"Sobre nós Somos parte de um dos pilares estratégicos do Magalu e desenvolvemos internamente as tecnologias de meios de pagamento do nosso ecossistema. Nós últimos anos, crescemos exponencialmente e nos tornamos uma das maiores empresas do setor. Oferecemos soluções como: Nosso propósito é claro:digitalizar empresas e promover inclusão financeira, especialmente entre os empreendedores brasileiros.",Não informado,https://magalu.inhire.app/vagas/c6b0ca29-d542-4f44-a535-fd2692ad2232/cientista-de-dados-sr,2026-03-12 11:48:50
MJV,Analista DataViz,Não informado,"Descrição da Vaga:Buscamos um(a) Analista Data Viz com forte capacidade analítica e senso estético apurado para desenvolver dashboards interativos, intuitivos e eficientes. A pessoa será responsável por transformar dados em insights visuais claros, garantindo a melhor experiência para os usuários e stakeholders. Responsabilidades: Desenvolver dashboards e relatórios interativos em Power BI, com foco em usabilidade e performance.",Não informado,https://mjv.inhire.app/vagas/af15c708-a2e5-424a-89e6-3099177b2cec/analista-dataviz,2026-03-12 11:49:32
MJV,Cientista de Dados,Remota,"Sobre Nós:A MJV Technology & Innovation é uma consultoria global com escritórios na Europa, América Latina e América do Norte. Atuamos como parceiros dos nossos clientes para identificar criativamente oportunidades que inspirem crescimento e promovam mudanças, com foco em transformações empresariais por meio de Design Thinking e estratégias digitais.https://www.mjvinnovation.com Descrição da Vaga: Perfil esperado:","Formação em áreas quantitativas (Estatística, Matemática, Física, Engenharia, Ciência da Computação ou áreas correlatas); | Experiência prática com Python para análise de dados e modelagem; | Conhecimento sólido de SQL; | Boa base em estatística, probabilidade e análise de dados; | Capacidade de aprender rapidamente novos domínios e contextos;",https://mjv.inhire.app/vagas/2882f0aa-cf0a-46f8-9510-622b47530230/cientista-de-dados,2026-03-12 11:50:11
MJV,Designer Gráfico (experiência em Dataviz),Remota,"Buscamos um(a) profissional que una sensibilidade estética e pensamento analítico, capaz de transformar dados complexos em visualizações claras, estratégicas e visualmente impactantes. O foco da função é estruturar informações, indicadores e análises em formatos visuais que apoiem a tomada de decisão e apresentações executivas, garantindo consistência visual e precisão dos dados. Principais Responsabilidades","Domínio do pacote Adobe (Illustrator, Photoshop, InDesign) ou ferramentas equivalentes. | Experiência com ferramentas de visualização de dados (ex.: Power BI, Looker, Tableau ou similares). | Conhecimento em princípios de Data Visualization (hierarquia visual, contraste, clareza, redução de ruído). | Experiência na criação de apresentações executivas. | Boa compreensão de métricas e indicadores de negócio.",https://mjv.inhire.app/vagas/dcbe3390-06b0-42f1-b7f8-0e23c77f1e34/designer-grafico-experiencia-em-dataviz,2026-03-12 11:50:19
NOMADGLOBAL,Analista de Dados Pleno em Fraude & PLD | Vaga afirmativa para mulheres,Remota,"O nosso produto chegou às lojas de aplicativos em novembro de 2020. De lá pra cá, mais de 3,5 milhões de pessoas descobriram com aNomadas vantagens de uma vida financeira internacional sem fronteiras e a nossa jornada está apenas começando. Nos orgulhamos em lançar produtos e serviços inovadores, provando que é possível ser global sem dor de cabeça e que investir em dólar pode ser para todo mundo. Para quem é Nomad, não existe ponto final. Continuamos evoluindo, inventando e reinventando. Transf...",Não informado,https://nomadglobal.inhire.app/vagas/07bff4c7-4017-44b5-99fe-577d765ed5fa/analista-de-dados-pleno-em-fraude-and-pld-or-vaga-afirmativa-para-mulheres,2026-03-12 11:51:44
NOMADGLOBAL,Analista de Dados Sênior,Remota,"O nosso produto chegou às lojas de aplicativos em novembro de 2020. De lá pra cá, mais de 3,5 milhões de pessoas descobriram com aNomadas vantagens de uma vida financeira internacional sem fronteiras e a nossa jornada está apenas começando. Nos orgulhamos em lançar produtos e serviços inovadores, provando que é possível ser global sem dor de cabeça e que investir em dólar pode ser para todo mundo. Para quem é Nomad, não existe ponto final. Continuamos evoluindo, inventando e reinventando. Transf...",Não informado,https://nomadglobal.inhire.app/vagas/9833d335-056d-4c9a-a8dd-d86e959ecf73/analista-de-dados-senior,2026-03-12 11:51:51
PAYTRACK,Analista de Dados Sênior,Presencial,"Se você é apaixonado por resolver problemas e desenvolver soluções, e quer trabalhar com tecnologias de ponta em um ambiente dinâmico, esta vaga é para você! Somos umascale-upcom resultados incríveis, crescendo rápido e ainda com muito a ser estruturado, criado, testado, adaptado, expandido - grande oportunidade para colocar em prática seus conhecimentos, ser muito reconhecido, deixar sua marca na nossa história (e uma marcona no seu currículo). Buscamos resultados ambiciosos para os próximos an...",Não informado,https://paytrack.inhire.app/vagas/1332a69e-31a6-4670-a6e5-2f6ed7cd3450/analista-de-dados-senior,2026-03-12 11:53:18
PAYTRACK,Analista de dados Travel|SP,Não informado,"A Paytrack é uma empresa líder em soluções de viagens, pagamentos e despesas coorporativas. Atendemos mais de 1000 grandes clientes corporativos. Nossa missão é simplificar a gestão de despesas corporativas, tornando-a tão intuitiva e eficiente quanto as experiências pessoais, ao mesmo tempo em que acomodamos a complexidade exigida por grandes empresas. Trabalhar comoAnalista de Dadosaqui na Paytrack é uma excelente oportunidade de contribuir para os resultados da empresa e conquistar o seu espa...",Não informado,https://paytrack.inhire.app/vagas/f925dc44-7a71-4272-9d05-30d8d6d12699/analista-de-dados-travelorsp,2026-03-12 11:53:26
RADIX,Profissional  Cientista de Dados Sênior,Remota,"A primeira coisa que você precisa saber é que aqui você não vai cair na rotina. A Radix desenvolve soluções para empresas de diferentes setores e indústrias. Cada projeto tem suas tecnologias, soluções e prazos e você terá oportunidade de atuar e experimentar diferentes desafios. Além da nossa atuação pelo Brasil, com escritório no Rio de janeiro, São Paulo e Belo Horizonte, temos também filiais nos Estados Unidos, fazendo com que a Radix se consolide cada vez mais como uma empresaglobal. Quer f...",Não informado,https://radix.inhire.app/vagas/d7c2a00b-bb75-4e28-bd3b-943728e84f04/profissional-cientista-de-dados-senior,2026-03-12 11:54:54
UPFLUX,Analista Funcional (Processo & Dados) | Pleno,Remota,"Buscamos uma pessoaAnalista Funcionalpara atuar nagestão e implantação de projetos em saúde, sendo responsável por conectar as necessidades do negócio e da área clínica às soluções técnicas e analíticas da plataforma.Essa posição atua de ponta a ponta nos projetos, garantindogovernança, qualidade das entregas e sustentação, em ambientes complexos e altamente regulados.  ","Experiência comimplantação e/ou gestão de projetosem ambientes tecnológicos; | Forte capacidade decomunicação e tradução entre cliente e time técnico; | Vivência comlevantamento de requisitos, análise funcional e mapeamento de processos; | Experiência comgestão de demandas, priorização e acompanhamento de entregas; | Familiaridade com ferramentas comoJIRA, Notionou similares;",https://upflux.inhire.app/vagas/13e2be86-4468-4545-855b-4b54bc862ff8/analista-funcional-processo-and-dados-or-pleno,2026-03-12 11:58:28
UPFLUX,Engenheiro de Dados & Valor,Não informado,"Buscamos um Arquiteto de Soluções e Dados com perfil consultivo e visão sistêmica para a área de Engenharia de Valor, sendo o elo técnico em pré-vendas que viabiliza a materialização de Process Intelligence em ROI para nossos clientesEnterprise. Além de ser responsável pela infraestrutura de dados na pré-venda, atuará como um facilitador estratégico, entrando em discussões de alto nível com times de TI e Segurança da Informação.  Design de Integração:Projetar e viabilizar arquiteturas de extraçã...","Sólida experiência em arquitetura de dados, incluindo design de APIs, Webhooks, infraestrutura Cloud e microserviços;",https://upflux.inhire.app/vagas/1d68828f-73d2-4c71-9a5d-db83eb909f06/engenheiro-de-dados-and-valor,2026-03-12 11:58:35
UPFLUX,Engenheiro de Dados Python | Pleno,Remota, A UpFlux é a primeira plataforma de Process Mining do Brasil! 🚀 A nossa missão é gerenciar e melhorar a eficiência operacional de processos através do mapeamento de ineficiências com uso de inteligência artificial.,"Experiência com Python; | Bibliotecas (Pandas, NumPy, Polars, etc...); | Conhecimento em processamento de grandes volumes de dados; | Conhecimento em bancos de dados relacionais e não relacionais; | Conhecimento em APIs REST;",https://upflux.inhire.app/vagas/3bb9a78d-547e-453a-b6eb-251582507afa/engenheiro-de-dados-python-or-pleno,2026-03-12 11:58:42
